{
  "metric_id": "india_port_dwell_time",
  "display_name": "Indian port dwell time",
  "display_subtitle": "JNPT + Mundra avg · weekly",
  "section": "freight",
  "sub_cluster": "ports",
  "value": 0.95,
  "unit": "days",
  "value_format": "decimal_1",
  "as_of": "2026-04-14T07:00:00.000Z",
  "as_of_period": "quarterly",
  "mom_pct": null,
  "yoy_pct": null,
  "vs_5y_avg_pct": -8.4,
  "sparkline_12m": [
    3.8,
    4.8,
    0.95,
    0.95,
    0.95,
    0.95,
    0.94,
    0.94,
    0.95,
    0.95,
    0.95,
    0.95
  ],
  "status": "med",
  "shock_eligible": false,
  "trend_direction": "bad",
  "source_primary": {
    "name": "JNPT + Mundra port authority weekly bulletins",
    "url": "https://www.jnport.gov.in/",
    "type": "Official",
    "frequency": "Quarterly",
    "parser": "llm:google_news_llm_v1"
  },
  "source_crosscheck": [
    {
      "name": "Container line schedule reliability (Sea-Intelligence)",
      "url": "https://www.sea-intelligence.com/",
      "type": "Public"
    }
  ],
  "verification_state": "verified",
  "last_verified_at": "2026-05-26T09:50:20.366Z",
  "why_it_matters": "Average days from vessel arrival to cargo discharge. Rising dwell times = port stress, often precedes container rate spikes domestically.",
  "linked_metrics": [
    "drewry_wci",
    "port_cargo",
    "hormuz_throughput"
  ],
  "notes": "Hormuz disruption may compound: vessels re-routing causes bunching at India ports; first signal expected next 2-4 weeks."
}
