{
  "metric_id": "driver_freight",
  "display_name": "Freight",
  "display_subtitle": "Driver score · 0–100",
  "section": "composites",
  "sub_cluster": "driver",
  "value": 66,
  "unit": "/ 100",
  "value_format": "integer",
  "as_of": "2026-05-05T15:36:07.531Z",
  "as_of_period": "live",
  "mom_pct": 25,
  "yoy_pct": 34.6,
  "vs_5y_avg_pct": null,
  "sparkline_12m": [
    52,
    51,
    53,
    54,
    56,
    55,
    57,
    58,
    60,
    56,
    70,
    66
  ],
  "baseline_30d": 56,
  "deviation_from_baseline_pct": 25,
  "status": "high",
  "shock_eligible": true,
  "shock_rule": "value > 80 OR Hormuz status=shock",
  "trend_direction": "bad",
  "source_primary": {
    "name": "IRM derived",
    "url": "https://irm.local/methodology/drivers#freight",
    "type": "Manual estimate",
    "frequency": "Live",
    "parser": "manual:derived_v1"
  },
  "source_crosscheck": [
    {
      "name": "Underlying freight metrics reconciliation",
      "url": "https://irm.local/methodology/drivers",
      "type": "Manual estimate"
    }
  ],
  "verification_state": "verified",
  "last_verified_at": "2026-05-05T15:36:07.532Z",
  "why_it_matters": "Freight driver dominated by Hormuz collapse + VLCC tanker rate spike (+220%). WCI elevated. Port congestion building.",
  "formula": "Weighted avg of feeder z-scores. Feeders: drewry_wci w=3, baltic_dry_index w=2, vlcc_tanker_rates w=3, india_port_dwell_time w=2. Normalized weights: 30%/20%/30%/20%. Hormuz contribution flows through driver_oil_physical (correlation handled at top level, not double-counted here).",
  "methodology_version": "v2-2026-05-12",
  "trigger_thresholds": [
    {
      "level": "med",
      "rule": "value > 50"
    },
    {
      "level": "high",
      "rule": "value > 65"
    },
    {
      "level": "shock",
      "rule": "value > 80 OR any input metric in shock state"
    }
  ],
  "linked_metrics": [
    "hormuz_throughput",
    "vlcc_tanker_rates",
    "drewry_wci",
    "baltic_dry_index",
    "india_port_dwell_time"
  ]
}
